{
  "schema_version": 1,
  "workflow_id": "memory-wuxian-v2.20.0-unified-installer",
  "epoch_id": "E001",
  "step_id": "S01",
  "attempt": 1,
  "evidence_id": "defect-preflight",
  "authorization_receipt_sha256": "",
  "producer": {
    "kind": "command",
    "name": "memory-wuxian-command-recorder",
    "version": "1"
  },
  "invocation": {
    "argv": ["defect_workbook_gate.py", "preflight", "--artifact-profile", "software-feature", "--change-kind", "repair"],
    "cwd": ".",
    "runner": "local-process",
    "exit_code": 0,
    "source_commit": "01b025c9dd500531f51349e3dca542cdf2b83da1",
    "source_snapshot_sha256": "6c61949017b66a27a9c8d509ca7a8f7ef5baf841e88b01f52d75812e737004ef"
  },
  "artifacts": [
    {
      "path": "docs/install-transaction/evidence/s01-defect-preflight-result.json",
      "sha256": "635f10dbc94fde6402341a6f7d2f76af28ada13292a92908c6d9fc167a788800",
      "role": "defect-preflight-receipt"
    }
  ],
  "subjects": []
}
