{
  "schema_version": 1,
  "workflow_id": "memory-wuxian-v2.20.0-unified-installer",
  "epoch_id": "E001",
  "step_id": "S08",
  "attempt": 1,
  "evidence_id": "historical-regression-tests",
  "authorization_receipt_sha256": "",
  "producer": {
    "kind": "test",
    "name": "memory-wuxian-test-recorder",
    "version": "1"
  },
  "invocation": {
    "argv": [
      "python",
      "-m",
      "unittest",
      "tests.test_windows_installer_runtime",
      "tests.test_windows_installer_broker",
      "tests.test_windows_installer_transaction",
      "tests.test_windows_installer_composition",
      "tests.test_windows_lifecycle_transaction",
      "tests.test_auto_update",
      "-v"
    ],
    "cwd": ".",
    "runner": "local-python",
    "exit_code": 0,
    "source_commit": "01b025c9dd500531f51349e3dca542cdf2b83da1",
    "source_snapshot_sha256": "47a2886a1e723848fa33c96f53750a58d5721c4d01a2dfdfee60e4a02c212038"
  },
  "artifacts": [
    {
      "path": "docs/install-transaction/evidence/s08-historical-regression-tests-result.json",
      "sha256": "ada718d6aa6984c8e491908eaf1bcd73912eda00adccde15a4a206b8edc78653",
      "role": "test-result"
    }
  ],
  "subjects": []
}
