{
  "schema_version": 1,
  "workflow_id": "memory-wuxian-v2.20.0-unified-installer",
  "epoch_id": "E001",
  "step_id": "S07",
  "attempt": 1,
  "evidence_id": "minimal-root-cause-diff",
  "authorization_receipt_sha256": "",
  "producer": {
    "kind": "inspection",
    "name": "memory-wuxian-inspection-recorder",
    "version": "1"
  },
  "invocation": {
    "argv": [
      "git",
      "diff",
      "319b1b23e90deaba92757da381de985e031b9853..8dd7281",
      "--",
      "scripts/windows_installer_broker.py",
      "tests/test_windows_installer_runtime.py"
    ],
    "cwd": ".",
    "runner": "local-readonly",
    "exit_code": 0,
    "source_commit": "01b025c9dd500531f51349e3dca542cdf2b83da1",
    "source_snapshot_sha256": "47a2886a1e723848fa33c96f53750a58d5721c4d01a2dfdfee60e4a02c212038"
  },
  "artifacts": [
    {
      "path": "docs/install-transaction/evidence/s07-minimal-root-cause-diff-result.json",
      "sha256": "250c82a55ba0debd9fc7020f76413df64e1f7c2851714cc400615ad182508f5e",
      "role": "diff-audit"
    }
  ],
  "subjects": []
}
